Author,Country,Date,Speech,Title,URL
Justin Trudeau,Canada,2020-10-20,"Good morning, everyone.
I’m happy to be here with Deputy Prime Minister Freeland and Minister Ng, as well as Dr. Tam and Dr. Njoo.
Canada has now passed a total of 200,000 cases of COVID-19 since the spring, with almost 22,000 active cases across the country today.
Here, and around the world, the fight against this virus is far from over.
And in order to win it, we have to keep working together.
Canada is a big country, and the pandemic is playing out differently in different provinces and territories.
That’s why I’m asking everyone to keep following the guidelines of their local public health authorities.
This is a Team Canada effort – and when you wear a mask, limit your in-person close contacts, and use the free COVID Alert app – you’re doing your part. 
As a government, we’re doing ours, too.
Since March, we’ve received almost 800 million pieces of personal protective equipment – masks, gloves, gowns, and face shields – to protect frontline workers and Canadians.
This month alone, we’ve distributed over 20 million pieces of PPE to the provinces and territories.
And we’re continuing to work around the clock to ship even more to the frontlines.
As we are doing all we can to ensure that Canadians stay healthy, we continue to step up our efforts to also keep our economy healthy.
This week is Small Business Week.
It’s a chance to recognize the enormous contribution that small businesses make to our country.
In recent weeks, I’ve talked to many entrepreneurs and business leaders, who offered some suggestions and also expressed their concerns.
Small businesses are the heart of our communities, the backbone of our economy, and our government is there for them.
We’re there for people like Charles-Ugo Boucher, owner of Café Larue, in my own riding of Papineau. The wage subsidy extension will help him keep his employees on the job.
During Small Business Week, I want to take a moment to recognize the hard work and perseverance that so many people put in every day, and especially over the last six months.
Whether you’ve adapted your menu to make take-out easier, or used your 3D printers to manufacture PPE, your resilience and creativity is an inspiration.
With winter coming, many business owners are hoping that clients won’t be turned off by having to line up outside in the cold.
As a government, our goal is to help you and your employees, through this tough time. 
From the beginning of this crisis, we took immediate and significant action to help Canadian businesses keep their door open and their workers on the job.
For small business owners:
The wage subsidy, the new Emergency Commercial Rent Assistance program, which will go directly to small business tenants, and the Canada Emergency Business Account are there for you.
You have shown resilience and creativity, and our government will continue to take meaningful action to support you.
Recently, I spoke with many small business owners that shared their experience with me.
Dr. Hedy Fry introduced me to Lisa Arthurs, owner of Quick Nickel Clothing in Vancouver’s West End, for whom the new Canada Emergency Rent Subsidy provides direct help as she continues to work hard to keep her business running.
Of course, the extended wage subsidy and the expanded Canada Emergency Business Account are also there to help. 
Moving forward, we will continue to listen to the needs of small businesses, just like we listen to the needs of all Canadians.
We’ll be there for people, whatever it takes, as long as it takes.  
Unfortunately, our fight against COVID-19 isn’t over, and we must continue to follow the guidelines of our local public health authorities.
Wear a mask, download the free COVID Alert App, and limit your close contacts.
And as you’re making an effort to slow the spread of the virus, why not encourage small businesses in your neighbourhood and mark Small Business Week by ordering a meal from the restaurant down the street or buying a gift card for your favourite store.
I want to end this morning by taking a moment to talk about the Community Resilience Fund, which supports partnerships and innovation in countering online radicalization to violence.
The pandemic has increased the amount of time we spend in front of our screens.
And while the digital space is powerful, it’s not without issues.
Online hate is far too common, and all too often it can spill over into real life.
Better understanding violent extremism is key to preventing radicalization to violence, so that we can stop tragedies before they happen.
So far, the Community Resilience Fund has supported 39 projects across the country with a total of over $29 million.
Today, I can announce that we will invest in the YWCA Canada’s project, Block Hate: Building Resilience against Online Hate Speech.
This is an important project, and I know it will help keep our communities safe.
To all the groups and local leaders who are part of this fund: thank you for your vital work. 
Thank you.
",Prime Minister’s remarks on Small Business Week and the Community Resilience Fund,https://pm.gc.ca/en/news/speeches/2020/10/20/prime-ministers-remarks-small-business-week-and-community-resilience-fund
Justin Trudeau,Canada,2020-10-16,"Hello. Good morning everyone.
I’m pleased to be here with Dr. Tam and Dr. Njoo.
Minister LeBlanc is joining us virtually.
And Minister Rodriguez is also here with us to answer questions about Parliamentary happenings.    
Fighting COVID-19 is a Team Canada effort.
Right from day one, we’ve been working with all orders of government to keep people safe.
And during this second wave, that’s exactly what we’ll continue to do.
To begin with, it’s vital that frontline workers have access to personal protective equipment.
To date, the federal government has shipped almost 190 million pieces of PPE to the provinces and territories. 
At the same time, we’re providing support staff who can make over 14,000 contact tracing calls a day.
We’re also ramping up our testing at national labs across the country to help the provinces and territories with their surge capacity. 
In this second wave, just like in the first, our government stands ready to help our partners across the country keep Canadians safe.
We have been working with all levels of government, from day one, to protect you.
And that is exactly what we’re going to keep doing during the second wave.
COVID-19 isn’t just a health crisis – it’s an economic one too.
Workers and businesses across the country need support during this tough time. The fact is that the second wave has the potential to hit people really hard. So we’re going to keep stepping up to help.
Last week, I announced that we were creating the new Canada Emergency Rent Subsidy, which provides direct rent support to tenants. 
This is in addition to the extension of the wage subsidy, and the expansion of the Canada Emergency Business Account. 
These programs have been – and will continue to be – a lifeline for small business owners.
Just take Amarjeet Chandok who owns Taza Xpress in Brampton. When the pandemic first hit, Amarjeet worried about whether his business would survive.
But, by using the wage subsidy, the rent support program, and the Canada Emergency Business Account, he was able to keep his employees on the payroll and the lights on.
We’ll continue to be there for people like Amarjeet, and for small businesses right across the country that create good jobs and make our communities stronger.
We know that the second wave could hit very hard.
We are here to help. 
In our fight against COVID-19, we need all the tools we can get.
With over 4.5 million downloads, the free COVID Alert app is a powerful way to keep yourself and your loved ones safe.
The process is very simple and protects your privacy.
If you download the app, and come into contact with a person who then tests positive for COVID-19 and also has the app, it will alert you to take action. 
After receiving the alert, you can then go to a testing site or isolate yourself while waiting for your result.
This helps you to do your part to stop the transmission of this virus.
That’s why eight provinces now have the app fully up and running, and we’ll continue to work with Alberta and B.C. to get them to come on board too.  
If you haven’t already, I encourage you to go to the App Store or Google Play and download the app for free.    
We must keep taking the fight against COVID-19 seriously. This pandemic is still a very real threat.
For several weeks, you’ve been hearing me, the premiers, and public health officials urging everyone to double down on what we know works to flatten the curve and beat this second wave. 
Frankly, the numbers are still too high. And that has real consequences.  
Our frontline workers are at risk.
Our parents and grandparents in long-term care facilities are at risk.
And our loved ones who have pre-existing health conditions are at risk.
For businesses, many of which have just gotten back on the road to recovery, the second wave has pushed them to the brink once again.
This is very serious. But we have the power to turn things around.
So let’s keep doing our part for each other, and for the people that we love.
We need to keep taking this fight against COVID-19 seriously. Unfortunately, this pandemic is still a very real threat.
I understand your concern.
But we can still turn the tide.
So let’s keep doing our part to help others and to help those we love. As government, we will continue to be there for you.
This morning, I spoke with Prime Minister Pashinyan of Armenia to express our concern about the situation in Nagorno-Karabakh. 
I told him that Canada will continue to work extremely hard with all our allies to put an end to the violence.
I encourage all sides to engage in dialogue to find peaceful resolution to the conflict. This was echoed by Minister Champagne on his trip to Europe, which is wrapping up today.
Minister Champagne’s trip included a week of meetings with our allies to discuss the global fight against COVID-19.
He also had talks about how we can find meaningful ways to support democracy in Belarus.
Today, Minister Champagne met with opposition leader Sviatlana Tsikhanouskaya to show our support for her, and for the people of Belarus.
We will continue to work with our international partners to ensure that the people of Belarus make sure their voices are heard.
And finally, I want to take a moment to talk to kids out there across Canada. I know that these past six months or so have been really difficult for all of you. But I know many of you had birthdays, milestones to celebrate during these past months that were really difficult and a lot less fun than usual – no families, no extended families, no parties, no friends. These are things that kids are struggling with in this time of COVID. This weekend is my dad’s birthday, but it’s also my son Xavier’s thirteenth birthday. Turning thirteen is the big moment where you get to become a teenager and all the responsibilities that come with it, but it’s also a time where friends really matter, and not having a party is tough. But, as families, as Canadians, and as kids, we need to keep doing our part and keep safe, to protect our grandparents, to make sure that we’re slowing the spread of COVID-19.
We’ve asked an awful lot of everyone across the country, especially kids. But I want you to know that we’re going to continue asking a lot of you because I know you’re capable of it. We’re there for you. Make sure you’re leaning on each other, but know that we all need to do our part to keep people safe even when it’s our special day. 
Thank you very much everyone, and I will now let Minister LeBlanc take over.
",Prime Minister’s remarks on the measures taken to support Canadians during the COVID-19 pandemic,https://pm.gc.ca/en/news/speeches/2020/10/16/prime-ministers-remarks-measures-taken-support-canadians-during-covid-19
Justin Trudeau,Canada,2020-10-13,"Hello everyone.
It’s good to be here this morning with Dr. Tam and Dr. Njoo, as well as Minister LeBlanc, who’s joining us virtually.
I want to start this morning by addressing the unacceptable threats that were sent to a Toronto mosque over the weekend.
Islamophobia and right-wing extremism have no place in our country or our communities.
We must always stand united against hate or intolerance of any kind.
I would also like to revisit the terrible tragedy that occurred in Wendake over the weekend.
My thoughts are with the young victims’ family and friends, and with the people of the Wendake community.
We must get the bottom of what happened.
These young children had their whole lives ahead of them and we are all shocked by what happened.
We are living in unusual times.
We just had Thanksgiving weekend, and many people were unable to gather with their loved ones as they would have liked to.
But, despite the difficulties caused by this global crisis, Canadians are more united than ever. 
In the spring, we flattened the curve by all playing our part.
I know we can do the same this fall.
By continuing to download the free COVID Alert app—as 4.3 million people have already done—and by wearing masks and keeping our distance, we will once again flatten the curve and get through this pandemic.
And as you work hard to help your loved ones and your community, you can count on your government to always be there, by your side.
With rising COVID-19 cases, quick and accurate testing, deployed with the right strategy, has become more important than ever.
That’s why our government has been working around the clock with the provinces and territories to boost their testing capacity, while at the same time securing the world’s best rapid testing technology.
These efforts are paying off.
As Minister Anand announced, Canada recently secured up to 28.4 million rapid tests from Abbott.
And on that front in particular, we’re continuing to move forward.
Shortly, the federal government will be sending these new rapid tests—Abbott Panbio and Abbott ID NOW—to the provinces and territories.
Both of these new testing technologies are quick and reliable, so we’re getting them out to the frontlines as soon as possible.  
Our government is also continuing to provide surge support on processing tests, including for Ontario.
And for the First Nations communities of Kasabonika and Pikangikum, National Microbiology Lab employees are on the ground with testing kits.
It is vital that these communities—with cases of COVID-19—have the necessary testing capacity to control the spread of the virus and keep people safe.
From day one, we’ve worked with the provinces and territories to protect the most vulnerable.
Moving forward, that is what we will continue to do.
Soon, more Canadian Red Cross support will be deployed to a number of long-term care facilities.
Seniors must be safe and well cared for, and our government stands ready to help provincial counterparts in that work.
This is a point I will continue to make with the premiers at our twentieth First Ministers’ Meeting this coming Thursday.
Progress is also being made in terms of vaccines.
Toward the end of last week, Health Canada received an application for authorization for Pfizer and BioNTech’s vaccine candidate.
As with AstraZeneca’s application two weeks ago, this is another step toward a safe and effective vaccine for Canadians.
And while we’re on the subject, I would like to remind everyone to get a flu shot this fall.
It’s a good way to protect yourself, while helping hospitals and screening clinics to focus on fighting COVID-19 without being distracted by the flu. 
Our top priority is keeping you—and your family—healthy and safe.
That means protecting you from this virus, and also means ensuring you have the support you need to weather this storm.
Yesterday, applications opened for the new Canada Recovery Benefit.
The CRB provides $500 each week, for up to 26 weeks, for people who are self-employed or don’t qualify for employment insurance.
Since yesterday morning, over 240,000 applications have been received.
If you need this help but haven’t applied yet, go to the CRA’s My Account through Canada.ca, or call 1-800-959-2019 or 1-800-959-2041.
The application process is simple.
In fact, if you’ve used the CERB, you’ll find it very similar.
Our government will continue to do everything we can to support people through this crisis, whatever it takes, as long as it takes.
If you get COVID-19 and aren’t covered at work—the Canada Recovery Sickness Benefit is there for you.
If a family member gets sick and you need to care for them—look to the Canada Recovery Caregiving Benefit.
If you’re affected by COVID-19—we’ve strengthened employment insurance to be there for you.
And if you can’t access EI—the Canada Recovery Benefit is able to help.
And for business owners, there’s more support, too.
This crisis has been very difficult for businesses across the country.
So we’ve strengthened major programs that we created that have been a lifeline for them. 
On Friday, we outlined the new Canada Emergency Rent Subsidy, an expanded Canada Emergency Business Account, and the extension of the wage subsidy.
The new rent subsidy will provide support to businesses directly, not through landlords.
And the CEBA includes an additional $10,000 forgivable loan for those who need it.
We’ll also work to help businesses that temporarily shut down because of local public health directions.
Canadian businesses create jobs and drive our economy, and we will continue to be there for them every step of the way.
We’re all waiting for the moment when this pandemic is over: 
For the time when we can once again have a big family dinner, go to a crowded festival, or just have life return to normal.  
Those days will be back, but only if we all keep doing our part.
The numbers are still rising.
This is the time to double down on our efforts to stop the spread.
Our loved ones, our vulnerable family members, our frontline workers—they’re counting on us to do the right thing.
So follow public health guidelines and wear a mask.
Keep your distance and join the over 4.3 million people who have already downloaded the free COVID Alert app.
Together, we will get through this.
Thank you.
",Prime Minister’s remarks on COVID-19 testing and support for Canadians,https://pm.gc.ca/en/news/speeches/2020/10/13/prime-ministers-remarks-covid-19-testing-and-support-canadians
