Author,Country,Date,Speech,Title,URL
Justin Trudeau,Canada,2020-06-12,"Hello, everyone.  
I would like to begin this morning with an update on the deployment of Canadian Armed Forces members to long-term care facilities in Quebec.
Over the past few months, our government has been working with the provinces on providing care for seniors and the most vulnerable.
This includes by deploying members of the Canadian Armed Forces to certain long-term care facilities.
Our women and men in uniform are doing a remarkable job and are saving lives.
Since the end of April, the situation in several long-term care facilities has stabilized.
And many attendants are returning to work.
This means that the Canadian Armed Forces members who were deployed to a long-term care facility where things have improved can now go lend a hand in other centres where the situation is more critical.
This has allowed us to help over 35 long-term care facilities to date, and we will continue to redeploy Canadian Armed Forces members from facilities that are under control to new centres in need.
I want to be clear: the 1,400 Canadian Armed Forces members involved in Operation LASER are still in Quebec and are currently being redeployed to the long-term care facilities that are most in need.
Their help is still needed, so we’re making sure that our elders continue to have this vital support.
We are continuing our discussions with Quebec to develop a medium-term plan that will allow us to support the efforts until September 15.
The plan includes the active participation of the Canadian Red Cross with well-trained, paid people who will be as effective as the Canadian Armed Forces members.
The federal government will continue to be there for Quebecers.
To restart the economy, to get Canadians back on their feet, we need a coordinated, countrywide plan.
And at the heart of this approach must be how we do this safely.
In country after country, state after state, a pattern is emerging.
People make sacrifices needed to flatten the curve, but then, when governments decide to restart the economy, cases begin to rise again.
And after months of hard work, people are finding themselves right back where they started.  
Canada must learn from these lessons.
It’s clear that we have to make safety and control of this virus a top priority in this restart.
So that’s exactly what we’re doing.
Our government is working with the provinces and territories to bring in the right measures to keep Canadians safe and healthy. 
Last week, I put forward our government’s commitment – $14 billion towards a safe restart agreement, for the things that Canadians will need in the six months ahead.
At our meeting yesterday, the premiers, the Deputy Prime Minister, and I continued our discussion on what this plan might look like.
We talked about the measures needed, whether that’s childcare and paid sick leave, contact tracing and testing, or PPE, and support for the most vulnerable.
And we talked about the fact that we must keep working together to support Canadians right across the country.
Last night, the premiers and I also discussed the reports and videos that are now circulating, showing violence against Black Canadians and Indigenous people.
All levels of government need to work together to ensure that things change as quickly as possible.
We’ve all now seen the shocking video of Chief Adam’s arrest, and we must get to the bottom of this.
Like many people, I have serious questions about what happened.
The independent investigation must be transparent and be carried out so that we get answers.
At the same time though, we also know that this is not an isolated incident.
Far too many Black Canadians and Indigenous people do not feel safe around police.
It’s unacceptable.
And as governments, we have to change that.
In my discussion with the premiers yesterday evening, I brought this up.
All leaders were united in condemning racism, and in agreeing that we must do more to combat it.
I raised with them some of the ways we can work together moving forward, including on practical things like the adoption of body cameras.
This is something I’ve already discussed with RCMP Commissioner Lucki.
But, reforms are needed at all levels of policing, and these reforms need to happen quickly.
In the days and weeks to come, our government will continue to move as fast as we can with all of our partners.  
Women and men who serve in our police forces must be part of the solution.
They are people who’ve stepped up to serve their community.  
And they will be invaluable allies as we move forward to make sure that all Canadians are well served by these institutions.
Today, I also want to speak about the progress we’re making on travel, and on our work to keep Canadians safe.
Right now, physical distancing is still the best way to protect yourself and others.
Of course, there are some places, like on flights, where it’s not always possible to keep two metres apart.
That’s exactly why we’ve made it mandatory for travellers and staff to wear masks.
Our government is also looking at the new best practices in place around the world to protect people.
We’ve also worked with airlines and airports on standards they should have in place, whether that’s enhanced cleaning, or putting distancing measures as people wait in line.
And today, I can announce that we’re taking another step forward.
Our government is mandating temperature screening for air passengers through a phased approach, first for those travelling to Canada, then for those travelling from Canada, and finally for those travelling within Canada. 
A passenger who has a fever will not be permitted to board their flight.
Employees in the secured areas of airports will also be required to have their temperature checked.
There are strong measures already in place to keep people safe and this screening will add yet another layer of protection.
I know that Minister Garneau will have more to say about this later today.
Over the coming weeks and months, we will continue to explore other ways of protecting Canadians and limiting the spread of this virus.
Right across the country, in every city and town, Canadians are stepping up to help. 
If you want a great example, look no further than the Filipino-Canadian community.
In Surrey, the community set up a blood donation drive as their way to pitch in.
In Calgary, an organization called Fiesta Filipinos is raising money for care packages for families.
In Montréal, the Filipino community set up a meals on wheels program to deliver food to seniors who live alone or are confined.
Today, on Philippine Independence Day, we recognize all the contributions that Canadians of Filipino origin have made to Canada.
It is also an opportunity to address the obstacles this community continues to face.
As we celebrate Filipino Heritage Month, we can’t ignore the ways in which our country must do better.
Too many members of this community face discrimination, something that has gotten worse because of this pandemic.
There is no place in this country for racism against Asian Canadians, or anybody else.
Now, more than ever, we need to stand up against discrimination and injustice in all its forms.
As Canadians, we are always stronger together.
Thank you.
",Prime Minister’s remarks announcing new screening measures for air passengers,https://pm.gc.ca/en/news/speeches/2020/06/12/prime-ministers-remarks-announcing-new-screening-measures-air-passengers
Justin Trudeau,Canada,2020-06-11,"Hello, everyone.
Before I get started this morning, I want to talk about what happened in the House of Commons yesterday.
Our government tabled legislation that would, among other things, provide a much-needed, one-time payment of up to $600 for Canadians with disabilities.
To make sure this support could move forward, we separated the measures for people with disabilities from everything else in that legislation.
I want to take a moment to speak to everyone who lives with a disability, or cares for someone with a disability.
We will not give up.
We’re not going to let you be left behind.
And we’ll keep working to get you the help you need and deserve.
This morning, it’s great to be here at Régimbal Awards and Promotions, along with Minister Mona Fortier.
I’ve just had a chance to meet some of the employees, who showed me the new process they’re running for printing patterns on face masks.
As Luc here explained, this isn’t what their family business normally does.
When COVID-19 hit, they decided to pitch in.
They’ve already helped supply thousands of masks to people across Ottawa.
On top of that, they’re also contributing to the Ottawa Community Foundation’s COVID-19 Rapid Response Fund, and donating buttons that make wearing a mask more comfortable for doctors and nurses.
All across the country, we have seen small business owners step up and do their part.
But we cannot forget that we are going through a difficult time and that a lot of people need help at this time.
That is why our government is working around the clock to give businesses the support they need.
Whether it’s with the Canada Emergency Wage Subsidy or business loans, our priority has always been to help employers stay in business and keep their employees.
For this family business, just like so many others, the pandemic hit hard.
They had to go down to three employees, and they were worried about making ends meet.
Today, because they used the wage subsidy, this business is now back to 16 staff members.
I want to thank them for stepping up and using this program not only to stay up and running, but to protect people’s jobs.
Businesses like this, which use the support available, will help Canadians get through this tough time.
Because in addition to the wage subsidy, they’ve also accessed the Canada Emergency Business Account and the rent assistance.
And that gives this family business the confidence they need to keep their doors open and keep people on the payroll.
Small businesses are the backbone of our communities and the lifeblood of our economy.
So, as we look to restart and get Canadians back on their feet, making sure small businesses have the support they need will be key.
And on that front, this week we’ve taken yet another step forward.
This initiative calls on businesses to commit to five key public health measures – like physical distancing and handwashing – to protect customers and employees.
I encourage all business owners – whether you have a restaurant, a tech start-up, or a boutique – to join in today at postpromise.com.
Together, we can keep people safe.
And together, we can give Canadians the confidence that’s needed to restart our economy.
With this initiative and others, we’re making progress.
That said, we know there’s still more to do.
For many Indigenous businesses, the last few months have been extremely difficult.
We hear that.
So today, we’re investing an additional $133 million to support Indigenous businesses, protect jobs, and help communities weather this storm.
Of this funding, $117 million will help small and community-owned Indigenous businesses get through this tough time.
And our government will provide $16 million to support Indigenous businesses in the tourism industry, a sector that supports thousands of jobs across the country.
The goal is to help as many people as possible.  
I know Minister Miller will have more details to share about all of this later today.
Any plan to restart the economy must look at supporting businesses and workers.
But it has to go beyond that, too.
To move forward, we also need to make sure that our communities have the resources to keep providing the services Canadians need.
Last week, I announced that we would accelerate funding for municipalities.
Today, Minister McKenna is publicly releasing the amounts of funding that will be available for communities.
Our government has already delivered this money to the provinces and territories, so that it can get it out to cities and towns as soon as possible.
Providing municipalities with funding sooner than expected is just one part of the plan our government will be implementing to restart the economy safely and effectively across the country.
During the meeting with the provincial and territorial premiers later today, we will be discussing the next steps.
Last week, our government indicated that it was prepared to invest $14 billion in a safe restart agreement.
This money would help pay for everything we will need in the coming months.
This evening, we will be discussing what this safe restart will include, whether it’s funding for childcare, paid sick leave, the purchase of personal protective equipment, or support for those who are most vulnerable.
I want to end this morning by recognizing that yesterday, across Canada, many people took time out to celebrate Portugal Day.
This week, throughout Portuguese Heritage Month, we have a chance to celebrate the many ways that Luso-Canadians have made our country a stronger and better place.
Look no further than Nosso Talho in Toronto, a Portuguese grocery store that’s dropping off food to people who are struggling because of this pandemic.
The Portuguese community recognizes the value of family and the importance of hard work, and it has given so much to our neighbourhoods and cities.
I would like to thank all Canadians of Portuguese heritage for their many contributions, and I wish you all a wonderful Portuguese Heritage Month.
Communities of diverse backgrounds across the country continue to step up.
And I want to thank everyone who’s doing that for understanding that the way we get through this, is by getting through this together.
Thank you very much.
",Prime Minister’s remarks on the Canada Emergency Wage Subsidy and additional support for Indigenous businesses ,https://pm.gc.ca/en/news/speeches/2020/06/11/prime-ministers-remarks-canada-emergency-wage-subsidy-and-additional
Justin Trudeau,Canada,2020-06-10,"Hello everyone.
First, congratulations are in order.
You’ve worked so hard, for so many years, to get to graduation day and you should all be very proud of yourselves.
But let’s be real.
This day is nothing like you imagined it to be. And the world is a much different place than anyone could have predicted even a year ago.
It’s tough.
You should be celebrating with your friends, taking pictures in your gowns, attending the ceremony on campus.
Walking across the stage to get your diploma, waiting for the commencement speaker to finish their speech, and thinking about the parties that you’ll be attending later that night.
But this year is different.
You are different.
No student gets to choose the world into which they graduate, but if you could – and let’s be honest here – you probably wouldn’t have chosen the world of 2020.
The Australian bushfires linked to climate change. The horrific plane crash in Iran. The worst mass shooting in our country’s history. Horrifying scenes of police violence against Black people and Indigenous peoples.
And of course, the reason we’re all gathered here today virtually and not in person—COVID-19, which has triggered the greatest health and economic crisis in generations.
Recent events have brought a lot of hardship and uncertainty to your lives. And you’ve had to make unprecedented sacrifices.
You’ve had to totally rethink the coming months, the normal stresses of graduating, and next steps have just reached a whole new level.
2020 has also exposed the limitations and flaws of our world—the world that you are set to inherit.
That can be unsettling, and even alarming.
But it’s also a wake-up call.
A wake-up call on how much you are needed.
Because here’s the thing.
Your generation has acutely sensed what was wrong with the world, and what needed to be fixed.
You marched for climate change.
You had the courage to say “Me Too.”
You pushed us along the road to reconciliation.
You stood up because Black Lives Matter.
You demanded the freedom to love who you love. To be who you are.
Make no mistake. Getting a degree is a momentous achievement.
But you never needed a piece of paper to call out injustice.
You didn’t wait for this day to demand change. To create change.
Very few graduating classes in living memory will have faced a challenge of this magnitude, but the Class of 1939 comes to mind.
The Greatest Generation came out of the Depression to fight a world war that they didn’t start. And in the face of unprecedented destruction, they chose to rebuild the world, by rolling up their sleeves and pulling together. 
They built the institutions that carried us through the second half of the 20th century.
They set the world on a path of more solidarity, more compassion, more understanding.
They sacrificed a lot, they dreamed big, they worked hard, and they left us a world far better than they found it.
The challenge facing the Class of 2020 is not dissimilar.
The choices you will make – both big and small – in the next few years will decide the future of our country and of our world.
And I cannot think of a generation better prepared to set us on the right path forward.
COVID-19 has taken many things away from you, least of which is a proper graduation. The last few months have been incredibly frustrating.
But this pandemic is also teaching us important lessons.
For one, it’s taught us just how much we need one another.
To defeat this virus, everyone has to play their part—and young people have stepped up.
You’ve made real sacrifices to protect your elders.
You finished your degree online.
You haven’t hugged a friend, let alone had a date, in months.
And you’ve chosen to help out your parents, your neighbours, your community during this tough time.
Whether you’re volunteering with a local charity or helping a business adapt to the new normal, you are stepping up.
You get it.
What matters most is looking out for the most vulnerable, understanding the impact of our choices on others, and being there for each other.
This is what these unprecedented times are teaching you. And reminding us all.
That friends matter. That the people around us matter.
It’s time that we reclaim the idea of community, of being a good neighbour, of being a good friend both online and in real life.
That is something you are uniquely prepared to achieve.
You grew up seeing and engaging with people online who may not speak the same language as you or carry the same passport as you do, but who share your values, your outrage, your passion.
You came of age during events like Occupy Wall Street, the Arab Spring, the Quebec student protests, Idle No More, and the rise of populism and nativism around the Western world.
More recently, you’ve echoed the calls for democracy in Hong Kong. You’ve amplified the calls for more justice, more accountability, and more equality sparked in Minneapolis.
You understand not just the value, but the power, of community better than most.
And that’s why I trust that you will be the 21st century’s greatest generation.
You know what is wrong with the world and how to fix it.
Your job is not only to challenge people like me, but to bring us along.
The road ahead will not be an easy one.
There will be setbacks, disappointments, and heartbreak along the way.
But you have everything you need to achieve what you set your mind to.
You’re incredibly smart, skilled, creative, and ambitious.
You’re also passionate, kind, and empathetic.
And you’re Canadian.
You are connected to, and welcomed in, almost every corner of the world.
You appreciate the opportunities, privileges, and responsibilities that come with calling this country home.
But you also know that Canada is far from perfect. That we are still very much a work in progress.
And your generation has enthusiastically embraced the hard truth that we have to do better.
That doesn’t take away the deep pride that comes with being Canadian.
In fact, our determination to improve, our willingness to learn, and our optimism about the future is at the heart of who we are as a country.
We all know that Canada didn’t happen by accident and won’t continue without effort.
And if there is such a thing as Canadian exceptionalism, it’s not the belief that Canada is the best country in the world.
It’s knowing that we could be.
That our work is never finished.
That our golden age is always ahead of us.
I know the future can seem especially daunting.
But believe me when I say you have everything you need not only to achieve, succeed, and build, but to be happy.
No one gets to choose the world into which they graduate.
But you do get to choose the world that will be your legacy.
You, the Class of 2020, are different.
You were always different.
Recent events have just opened our eyes to what was right in front of us all along.
That you care.
You care about each other.
You care about people you’ve never met and never will.
You care about what happens next.
I know you got this.
And so do you.
",Prime Minister’s commencement speech to post-secondary graduates,https://pm.gc.ca/en/news/speeches/2020/06/10/prime-ministers-commencement-speech-post-secondary-graduates
