Author,Country,Date,Speech,Title,URL
Justin Trudeau,Canada,2020-04-25,"Hello everyone. Happy Saturday.
Before we get started today, I wanted to thank the organizers of yesterday’s vigil for the victims of the Nova Scotia shooting.
The pandemic may have prevented us from gathering in person, but we still found a way to come together to celebrate the lives of the victims and support their families. 
It was an extremely moving tribute, and it was just yet another example of how Canadians are there for each other in difficult times.
Once again, my thoughts and the thoughts of all Canadians are with the families and loved ones of the victims.
This week, our government announced more targeted support for Canadians who are going through an especially hard time because of COVID‑19.
With the Emergency Community Support Fund, we’re giving more resources to charities and non-profits so that they can continue their important work.
We also unveiled our $9-billion plan to help students and recent grads get through the next few months.
Because of COVID-19, there aren’t as many jobs for students as last year.
And without a job, it can be hard to pay for tuition or the day-to-day basics.
So, we launched the Canada Emergency Student Benefit, which gives students at least $1,250 a month from May to August.
At the same time, we’re creating 76,000 jobs for young people in sectors that need an extra hand right now or on the front line of the pandemic.
And if students prefer to volunteer and help in the fight against COVID-19, they’ll be eligible for a $1,000 to $5,000 grant through the new Canada Student Service Grant.
For small companies, we announced yesterday that we had reached agreements with all the provinces and territories to decrease their rent by 75 per cent for the months of April, May, and June.  
I would also like to take this opportunity to remind employers of all sizes that they will be able to start applying for the emergency wage subsidy on Monday.  
In the meantime, you can visit the Canada Revenue Agency’s website to calculate what the subsidy will cover.
Our government is providing assistance to meet the immediate and urgent needs of workers and businesses.
At the same time, we are also thinking about what lies ahead for us over the next few months.
We are providing more funding for medical research into COVID-19 and the development of vaccines.
This week, we created the COVID-19 Immunity Task Force, which will be responsible for tracing infections and gaining a better understanding of how we can immunize ourselves against the virus.
From the very beginning of the outbreak, our objectives as a government have been clear.
Help those who need it most.
Protect jobs.
Support the small businesses that make our communities better places to call home.
And lay the groundwork for our economy to come roaring back once this crisis is over.
In the past few weeks, our government introduced a series of measures to do just that, but we know there are more people to help. More work to be done.
So today, we’re announcing $62.5 million to support fish and seafood processors through this crisis.
As we fight COVID-19, people who work in fish and seafood processing plants across the country are playing a crucial role when it comes to getting food to our tables.
This funding will help ensure that they can safely continue their important work.
We’re giving more money to processors so that they can purchase personal protective equipment for workers, adapt to health protocols, and support other social distancing measures.
For example, fish processing plants could buy new equipment, like freezers or storage space, so that their product – food for Canadians – can stay good while they respond to a changing market.
With this announcement, we’re giving fish and seafood processors more resources to adapt to the many challenges brought on by the pandemic and, above all, keep workers safe.
Our fish sector is interconnected, so these investments will also have a positive impact on fish harvesters.
On that note, I want to take a moment to recognize the tremendous work that is being done by every person who makes Canada’s food system possible, including our food producers and fish harvesters.
You keep our grocery stores stocked and our families fed.
I know that the past few weeks have been really tough on you too – whether it be financially or emotionally.
I want to thank you all for everything you do for us.
You’re providing an essential service to the country.
We know that you have specific needs and asks right now, and we are actively exploring additional ways to support you as we move forward.
Yesterday, I had a call with the First Ministers and we talked about putting together a joint statement outlining what needs to be done to re-open the economy.
We’re working together with Canada’s chief medical officers to establish principles and guidelines for us all.
We have to be mindful that the economy and the realities of each province and territory are unique, so the timing and specific measures will be different across jurisdictions.
We need a coordinated approach nationally to avoid any confusion amongst Canadians.
We’re working together on a plan based on science, data, and expert advice that lays out our common ambition to see our country through this.
The next phase will be crucial.  
If we don’t get the next phase right, we risk losing all the progress we’ve made so far.
These conversations are ongoing and we will keep working together for all Canadians.
Tomorrow, there won’t be any press conferences either by doctors or myself, so I want to close this morning by talking to young Canadians as I do every weekend.
To all the kids watching out there – you’re doing great.
Keep helping out around the house.
Try to keep up with your schoolwork.
And above all, stay positive.
This is a tough time but we’re going to get through this together.
And to young people out there – many of you are students who need extra help and we’re here for you.
This week, we announced a series of measures to support you during this crisis.
But we need your help too.
This is a moment in our country’s history that we will look back on and ask each of ourselves what we did for our community. For our country.
What did we do to serve our country? To help the world?
And as you look at what you can do this summer, please remember that there are seniors who need your help.
There are front-line workers, including in our medical professions, who could use a helping hand.
And there are agricultural farmers and producers who’d love to see you step up to help feed Canadians.
Look at how you can use your energy, your drive, your vision for making the world a better place, and make it so.
How we get through this as a country depends on each of us. The choices we make, the actions we take.
So this weekend, stay home.
Keep washing your hands.
And if you need to go out for groceries, keep at least two meters apart from each other.
And think about what you can do in the fight against COVID-19 to support our front-line workers, to help your community.
I know we will help each other to get through this, because that’s just who we are as Canadians.
Thank you very much. Have a great weekend.
",Prime Minister’s remarks on support for fish and seafood processors,https://pm.gc.ca/en/news/speeches/2020/04/25/prime-ministers-remarks-support-fish-and-seafood-processors
Justin Trudeau,Canada,2020-04-24,"Hello everyone.
This has been a heartbreaking week for Nova Scotians and for all Canadians.
At 2:00 p.m. Atlantic time, we will observe a minute of silence in honour of Constable Heidi Stevenson and all the victims of the Nova Scotia shooting.
I also want to remind everyone that at 7:00 p.m. Atlantic time or 6:00 p.m. Eastern time, a virtual vigil will be held to remember those who were taken from us too soon and support their friends and family during this particularly difficult time.
I hope that many of you will join us and wear red today in a show of solidarity.
Let’s come together to support these communities who suffered immeasurable loss.
Let’s celebrate the lives of those who left us too soon. Let us remember the families, friends, loved ones whose absence will linger for years and lives.
You can find more information at novascotiaremembers.com
Since the beginning of the outbreak, our government has been working with its provincial and territorial partners not only to get through this crisis, but to position our economy to rebound once it’s over.
And a big part of this work means listening to the concerns of Canadians and making adjustments as we go along.
One thing we’ve heard is that small businesses are having trouble making rent because of COVID-19.
If you’ve had to close up shop because of public health recommendations, if you don’t have a lot of money coming in because people aren’t spending as much these days – you may be worried about losing your office space or not having a coffee shop to reopen after this crisis.
So last week, we said that we’re planning on introducing the Canada Emergency Commercial Rent Assistance.
And today I can announce that we’ve reached agreements with all provinces and territories to lower rent by 75 per cent for small businesses that have been strongly affected by COVID-19 for April, May, and June.
The government will cover 50 per cent of that reduction, with the property owner covering the rest.
If you are a small business that has been strongly affected by COVID-19 and you’re paying less than $50,000 per month on rent, you’ll be eligible to receive this support.
It will also be there for non-profits and charitable organizations that are struggling right now.
We’ll also have more to say in the coming days about rent support for larger businesses.
As I said yesterday, what we’re witnessing in long-term care facilities across the country is extremely troubling.
It’s unacceptable and our government will be there to help the provinces.
Members of the Canadian Armed Forces will be deployed after the Minister of Public Safety received and approved two formal requests from Ontario and Quebec.
Reconnaissance work is underway in both provinces. We’re identifying what needs to be done and mapping out next steps.
As I said many times before, we will be there for Quebecers, Ontarians, and all Canadians during this crisis.
We’re deploying the military to provide emergency support to help provinces regain control of the situation.
But we all know that this is only a short-term solution.
We’re also offering billions of dollars to provinces to top up the pay of essential workers and make sure that elderly Canadians get the support they deserve.
Later today, I’ll be meeting with the First Ministers to continue our work on supporting Canadians during this time.
We’re also going to talk about reopening parts of the economy.
Canada is a vast country and some regions have been hit harder than others during this pandemic.
We’re a federation, so we have to adapt our response to the realities and challenges of each province and territory.
But I want to be clear that getting back to normal will not happen overnight.
It’s going to take time. It won’t be as simple or as easy as flipping a switch.
It’ll require a lot of coordination at the national level and our government will be there to do that work.
We will be working with the provinces and territories to establish principles and guidelines to start reopening the economy safely.
Over the coming weeks, you’ll hear more talk about reopening, but you need to know we’re not out of the woods.
Since the beginning of this crisis, we have been learning about what’s being done in countries like South Korea, Japan, and Singapore.
But we see the challenges associated with reopening in certain places. So we have to be very careful.
Every location could take a different approach, so even if you hear on the news that another province is considering relaxing the rules, you must continue following the guidelines that apply in your location.
Otherwise, there’s a real risk that all the progress we have made to date will be lost.
It’s absolutely critical that everyone continues to follow local public health instructions as we move forward.
For now, these instructions are the same for all Canadians.
No matter where you live, you should be staying home as much as you possibly can.
You should be washing your hands regularly and you should always keep a safe distance of two metres from others.
That is the only way for us to make it through together.
Thank you very much.
",Prime Minister’s remarks introducing the Canada Emergency Commercial Rent Assistance,https://pm.gc.ca/en/news/speeches/2020/04/24/prime-ministers-remarks-introducing-canada-emergency-commercial-rent
Justin Trudeau,Canada,2020-04-23,"Hello everyone.
Today at sundown marks the beginning of Ramadan.
For many Muslim Canadians, the coming month will be different than normal, with iftar online and virtual Friday prayers.
But that won’t change what this special time is all about – generosity, compassion, and service to others.  
Across the country, Muslim Canadians are on the front lines of the fight against COVID-19 as nurses, doctors, and essential workers.
So thank you, and Ramadan Mubarak.
This will be another difficult day for many families and communities across the country.
We’re all thinking about those in Nova Scotia who are grieving the loss of loved ones, friends, and neighbours.
Yesterday, I spoke with the families of some of the people we lost.
They shared stories about their loved ones, and their dreams and plans.
In the face of such tragedy, their strength is remarkable.
I spoke also with RCMP members from the area and, on behalf of all Canadians, I thanked them for their service.
And I spoke to some local mayors as well to express my condolences.
For Torontonians, I know it’ll be a hard day as well, as we remember the victims of the van attack on Yonge Street two years ago.
Together we mourn, and together we heal.
Because just as Canadians were there for each other two years ago, we’re there for each other today.
Across the country, people are hanging tartan, blue ribbons, and scarves from windows to honour those who died.
With acts of kindness and donations, people are standing with families who are grieving.
And tomorrow, with the virtual vigil, we will all have the chance to show the people of Nova Scotia that they are not alone.  
These are tough times, but there is reason to hope. 
When it comes to COVID-19, what we’re doing is working.
And to continue on the right track, we need to be thinking not just about the next weeks, but about the next months.
We need medium-term and long-term solutions.  
On that front, I can announce today that we’re taking another step forward.
We’re putting in place an additional $1.1 billion for a national medical research strategy to address COVID-19.
This plan has three pillars: research on vaccines and other treatments, supports for clinical trials, and expanding national testing and modelling.
Let me start with the first pillar on research.
Under this plan, we are investing close to $115 million for research into vaccines and treatments being developed in hospitals and universities across the country.
This is on top of the funding we’ve already provided to support vaccine development in Canada.
The second pillar of the plan is to make sure that once we have potential vaccines and treatments, we can test a wide range of options.
Under this plan, we will invest over $662 million for clinical trials led by Canada.
A vaccine is the long-term solution to this virus.
But these drugs will take months to develop, test, fabricate, and roll out.
So until we have something ready, we need to control the spread of the virus.
And that’s where the third pillar of this plan comes in.
We’re investing $350 million to expand national testing and modelling of COVID-19.
This includes creating the COVID-19 Immunity Task Force.
The task force will operate under the direction of a leadership group, which will include Dr. David Naylor, Dr. Catherine Hankins, Dr. Tim Evans, Dr. Theresa Tam, and Dr. Mona Nemer.
We are bringing together top health experts and scientists from leading institutions across the country.
Canada’s best and brightest will be working on serology testing – blood testing – to track and understand immunity to COVID-19.
They’ll be looking at key questions like how many people beyond those we’ve already tested have had COVID-19, whether you’re immune once you’ve had it, and if so, how long that lasts.
Over two years, we will be testing at least a million Canadians as a part of this study.
The findings of the research will help with everything from rollouts of a potential vaccine, to determining which public health measures are most effective going forward.
We will get valuable data, including disaggregated data, to understand the impact on vulnerable populations.
And we will also leverage new and existing lab capacity for research.
The better we understand this virus, its spread, and its impact on different people, the better we can fight it, and eventually defeat it.
While this vital research is happening, we’re also staying focused on what we can do right now to control COVID-19 and get back to normal as soon as possible.
Testing is key.
We’ve now reached 20,000 tests daily, almost double where we were earlier this month.
But testing must increase even further before we can re-open and re-start our normal activities as a country.
You’ve been doing your part by staying home and practising physical distancing.
It’s working.
And we can’t afford to waste this progress.
Right now, we’re seeing terrible tragedies in long-term care facilities across the country.
This is unacceptable.
If you’re angry, frustrated, scared – you are right to feel this way.
We can do better.
We need to do better.
Because we are failing our parents, our grandparents, our elders – the greatest generation who built this country.
We need to care for them properly.
Canadians need to pull together.
There have been requests for military assistance by both Ontario and Quebec, which of course we will be answering.
Our women and men in uniform will step up with the valour and courage they have always shown.
In the short term, we will be there with support so that provinces can get control of the situation.
But this is not a long-term solution.
In Canada, we shouldn’t have soldiers taking care of seniors.
Going forward, in the weeks and months to come, we will all have to ask tough questions about how it came to this.
We will all have to do more to get through this terrible situation.
Everyone is working hard to get through this.
We are all part of the same team.
As we do our part, I know that everyone will be doing their part.
We will get through this together, and we will come back strong together.
Thank you.
",Prime Minister’s remarks on new support for COVID-19 medical research and vaccine development,https://pm.gc.ca/en/news/speeches/2020/04/23/prime-ministers-remarks-new-support-covid-19-medical-research-and-vaccine
