Author,Country,Date,Speech,Title,URL
Justin Trudeau,Canada,2020-05-09,"Happy Saturday everyone.
These days, a number of Canadians are going through hard times because of COVID-19.
The pandemic is an unprecedented challenge for our country, and Canadians are suffering the consequences.
However, some people and sectors are more deeply affected than others.
Therefore, this week, we announced other measures to help those that need them the most.
First, we are working on concluding an agreement with all of the provinces and territories to increase the salaries of essential workers.
These people have been on the front lines of the fight against COVID-19 since the start of the crisis. They are doing incredible work.
The best way to thank them is to ensure that they are well paid and protected.
And this week, thanks to this agreement, we are in the process of taking an important step towards putting more money in their pockets.
We also announced more support to help the food sector get through this crisis.
We are giving food processors more money to ensure the security of their workers.
We are planning on specific measures to help cattle and pork farmers, and dairy producers, adapt to market changes.
We are implementing a program that will help the government purchase products that are likely to be wasted, to redistribute them to charity organizations.
All in all, our government has proposed an additional $5 billion in lending capacity and a total investment of $510 million to support food security since the beginning of the crisis.
And as I said earlier this week, if we have to do more, we will do more.
For the past few weeks, our government has been focused on getting people the help they need as quickly as possible.
But to come out of this stronger than ever, we also have to think long-term.
We need to lay the groundwork now, so our economy can come roaring back.
So far, more than half a million small businesses have received a loan through the CEBA.
And less than two weeks since launching the Canada Emergency Wage Subsidy, employers have applied for subsidies for almost two million workers.
Our government is giving employers more resources, so they can stay in business and keep people on the payroll during this crisis.
Maintaining the connection between employer and employee will be key not just to help people get back on their feet, but also to our economy.
In that vein, we announced yesterday that we would be extending the Canada Emergency Wage Subsidy beyond June.
At the same time, we’re working with our partners from around the world to beat COVID-19 for good.
This pandemic is a global issue.
Keeping Canadians safe and restarting our economy means defeating the virus not just at home, but wherever it is found.
So earlier this week, we announced new investments to accelerate the global development of COVID-19 vaccines, treatments, testing, and research, including research being done here in Canada.
Over the past few weeks, we established new assistance programs for workers and businesses, but we know that the work is far from complete.
As the situation evolves, needs and challenges also evolve and we adapt our response accordingly.
We are still listening to Canadians and still looking for ways to support them.
I want to close by asking all the moms to step out of the room for a minute so I can talk to your kids.
Okay, tomorrow is Mother’s Day, kids.
It’s a special day for all the people who are mothers to us – our moms, stepmoms, grandmothers, aunts, and older sisters.
So, let’s show them how much we love and care about them.
You might want to get up early to make her breakfast or ask dad to help you get her some flowers.
Or if you’re not together this year because of the virus or other reasons, you can draw her a card or set up a video call.
Whatever you do, I’m sure what you’ll choose to do will make her day and express how much you love her, how much you need her, and how much she has your full support and full love during this difficult time, but all the time as well.
Take advantage of this time and have fun. We will get through this together.
",Prime Minister’s remarks on recent measures to support Canadians during the COVID-19 pandemic ,https://pm.gc.ca/en/news/speeches/2020/05/09/prime-ministers-remarks-recent-measures-support-canadians-during-covid-19
Justin Trudeau,Canada,2020-09-24,"Thank you, Mr. Speaker.
It is with a heavy heart that I rise today in this House to pay tribute to the late Right Honourable John Turner, Canada’s 17th Prime Minister.
I knew John my whole life, and he believed fiercely in the values that make us who we are as Canadians.
Values like treating everyone with dignity and respect. And always being willing to stand up for what is just and right. 
Today, we remember him as a House of Commons man – a strong advocate for equality and a champion of our democracy.  
Mr. Speaker, we live in a wonderful country, and it is thanks in part to people like John Turner.
John’s commitment to democracy started very early in his life. When he was young, his mother taught him the importance of public service.   
Throughout his career – first as a lawyer and later as a politician – he always demonstrated grace and humility.
John treated everyone with dignity and respect. No matter how busy he was, he never forgot anyone’s birthday. 
As an MP, John had the privilege of serving three different provinces.
His work as Minister of Justice paved the way for legal aid in Canada, to ensure that everyone’s rights were recognized – no matter their economic or cultural profile.
These changes have transformed the lives of millions of Canadians.
Mr. Speaker, when talking about John, it’s easy to see how much he loved Canada.
John always spoke of his country with great hope and optimism.
To him, Canada is a country where we help each other and we respect each other. A country where equality is a way of life.
It was just last year that John was on the Hill to celebrate his 90th birthday with people from across the political spectrum. And I remember how he was still passionate about strengthening our democratic institutions.
He used to say that “democracy doesn’t happen by accident.”
He was right.
John knew that keeping our democracy strong and free meant we needed to put in the hard work to keep it that way.
He believed in the incredible power of young people to get involved in our democratic process, and encouraged them to do that, wherever he could. 
John knew Canadians, regardless of age or background, formed the heart of our country, and that our future depended on all of us working together, for everyone.
Today, as we mourn his loss and reflect on his legacy, let’s all remember our ability to give back to our own communities.
To his wife Geills, their children Elizabeth, Michael, David, and Andrew, to John’s grandchildren, his sister Brenda Norris, and brother-in-law David Kilgour – your husband, loving father, and brother was a great Canadian.
We are all so lucky you shared him with us.
To my fellow Canadians, I invite you to join us in signing the virtual book of condolences.   
And together, let us continue to work to defend and strengthen our democracy, and as John once said, “let’s not take this country for granted.”
Thank you, Mr. Speaker. 
",Prime Minister’s remarks paying tribute to the Right Honourable John N. Turner,https://pm.gc.ca/en/news/speeches/2020/09/24/prime-ministers-remarks-paying-tribute-right-honourable-john-n-turner
Justin Trudeau,Canada,2020-09-23,"Hello everyone.
My fellow Canadians, good evening. In the West, good afternoon.
I want to speak directly to you today because Canada is at a crossroads. 
I know that the fight against COVID-19 has been difficult for all Canadians over the past six months.
For too many people, it’s a matter of life and death.
And for all of us, collectively, it’s the fight of our generation. 
In the spring, we all worked together to flatten the curve, and our efforts paid off. But now, the virus is coming back in full force in several parts of the country.
In our four biggest provinces, the second wave isn’t just starting – it’s already underway.
The numbers are clear. Back on March 13 when we went into lockdown, there were 47 new cases of COVID-19. Yesterday alone, we had well over 1,000.
I know this isn’t the news that any of us wanted to hear. And we can’t change today’s numbers or even tomorrow’s – those were already decided by what we did, or didn’t do, two weeks ago.
But what we can change is where we are in October, and into the winter. It’s all too likely we won’t be gathering for Thanksgiving, but we still have a shot at Christmas.
Together, we have the power to get this second wave under control.
I know we can do it, because we’ve already done it once before. In the spring, we all did our part by staying home. And this fall, we have even more tools in the toolbox.
People are wearing masks. That’s critical, so keep it up.
We’ve got the COVID Alert app.
Take the teacher who felt fine, but who tested positive after the app warned her she’d been exposed. COVID Alert meant she went home instead of the classroom. 
It’s a powerful, free tool that’s easy to use and protects your privacy. So if you haven’t already, download it off the App Store or Google Play Store. It’s one more way to keep ourselves and others safe.
Another is to get your flu shot this fall.
The steps we’re taking today will make all the difference in what will happen in two weeks and in two months.
Wear a mask – it saves lives.
Wash your hands.
Keep your distance.
Get your flu shot.
Listen to public health agencies. As Dr. Tam said yesterday, limit your social circle. Avoid taking unnecessary risks.
This is not the time to have parties.
No one is invincible. Your loved ones aren’t invincible. 
We cannot let our guard down, even in places where the number of cases is still low.
And everybody, please, download the COVID Alert app. It is free and easy to use, it protects your privacy, and it will protect you and the people around you.
This is the time for all of us, as Canadians, to do our part for our country, as the government does its part for you.
There is a covenant between the government and the people that the government serves.
You need to know that you can rely on us, just like you can rely on each other.
As we face this crisis, as we get ready to rebuild, we will continue to be there for you.
The government put forth a four-part plan to respond to this crisis.
The first thing we have to do is to protect people’s health.
The actions of our parents and grandparents – the generation that faced the Great Depression and the Second World War – remind us that we have to be resilient and patient in times of crisis. They built the world of today. Now it’s up to us to build the world of tomorrow, and we have to start by protecting them.
The situation experienced by too many of our seniors in long-term care centres is unacceptable.
It must change, and it will change.
In the spring, we sent the Canadian Armed Forces to help, and the Canadian Red Cross is still on the ground.
We will work immediately with the provinces and territories to establish new national standards for long-term care.
Job one is keeping people safe.
In fact, because we mobilized this spring, Canadians are now producing almost every type of PPE we need.
We’re helping the provinces and territories ramp up their capacity on testing, while creating a federal response team for surge demand. And, as soon as there’s approval for faster tests to be used safely, we’ll get them out across the country. If you need a test, you should be able to get one, and get it quickly. This is about safety, and it’s about what’s right for Canadians.
Protecting your health is the best thing we can do for the economy.
So that’s what we’re working on first.
And that brings me to the second part of the plan – supporting Canadians through this pandemic.
The federal government will have your back, whatever it takes, to help you get through this crisis.
Maybe you were one of the almost nine million people who used the Canada Emergency Response Benefit this spring. We will continue to support all those who need it with a strengthened and broadened Employment Insurance system.
Maybe your boss was able to keep you on the job, or hire you back, because the Canada Emergency Wage Subsidy helped with the payroll. People still need this program, so we’re extending it right through to next summer.
Or perhaps you’re a business owner, needing extra help to bridge to better times. For you, among other measures, we’re expanding the Canada Emergency Business Account.
And there’s a lot more we’re going to do.
Go to Canada.ca/coronavirus to see what support is available right now, and how to apply.
I know some people are asking how we can afford to do all this for Canadians. That’s fair.
Low interest rates mean we can afford it. And in fact, doing less would end up costing far more. Doing less would mean a slower recovery and bigger deficits in the long run.
While we’re dealing with this pandemic, I don’t want you – or your parent, or your friend – to take on debt that your government can better shoulder.
So yes, in the short term, we’ll keep investing.  
But beyond the emergency, as we start to build back better, we must do that in a fiscally sustainable way. Investing for our recovery must be done responsibly.
You know, the pandemic is revealing the fundamental inequalities in our society, but now, we have the opportunity to take action to change that.
We will build a better society for everyone, while at the same time making the economy better for everyone.
This is the third part of the government’s approach.
By creating a Canada-wide early learning and childcare system, we’ll ensure that kids have access to care, and that no parent – especially no mother – has to put their career on hold.
This pandemic has reminded us all that building strong social supports is essential to growing the economy.
By accelerating progress on national, universal pharmacare, we’ll get people the medicine they need, while alleviating pressure on the health care system.
By investing to eliminate chronic homelessness, we will create healthier, more prosperous communities.
Housing is not just a problem – it’s also a solution.
It creates jobs.
It enables people to grow and contribute. 
We all want to build a stronger country for everyone. To do this, we must redouble our efforts to fight climate change.
This is also the best way to ensure good jobs for today and for the future.
Energy workers innovating to decarbonize. Auto workers building zero-emissions vehicles. Engineers and construction workers delivering green retrofits for our homes and buildings. 
These are some of the people who will create a competitive economy of the future.
As we do this work – protecting people’s health, supporting Canadians, building back better – we can’t forget what it’s all for:
Making sure that everyone can participate to their full potential. And that’s the final part of the plan.
As a country, we must keep making progress on reconciliation with Indigenous peoples, and on fighting systemic racism.
Diversity is not just our strength, it’s our competitive edge.
Our differences make us stronger, no matter the colour of our skin, our beliefs, our culture, or our language.
In our country, we are proud to have two official languages – English and French – that we will continue to protect.
In Canada, we know that we are stronger when we come together and when we help each other. We face challenges together.  
That is what has helped us manage the crisis better than many others.
This is not the first time our country has been called to stand united and strong.
In the face of change, our Greatest Generation showed us that overcoming crisis isn’t easy.
They didn’t give up. And neither can we.
To parents feeling like you can’t get your life under control;
To kids wondering why mom and dad can’t just fix this;
To seniors feeling like there’s nothing you can do, and thinking about all the things you can’t do:
That’s understandable.
But can’t will not define us.
We can bend the curve.
We can build a stronger future.
We can define the change.
As Canadians, we are people who say, “I can”.
In every sector, all across the country, every one of us is doing our part.
The story of this pandemic is the story of people who are making sacrifices. It’s the story of people who work hard every day to be there for each other.
This is especially the story of our front line workers – heroes, from coast to coast to coast, who have never hesitated, who have never backed down from this fight.
You are an inspiration to us all.
We are at a crossroads, and the future is in our hands.
There are many days to go before we get to the other side of this.
But there are also many of us to get us there, so long as we each remember to do our part. And I know that we will.
We are Canadians.  
And together, there’s nothing we can’t do.
Take care of yourselves, my friends.
Thank you.
",Prime Minister’s remarks addressing Canadians on the COVID-19 situation,https://pm.gc.ca/en/news/speeches/2020/09/23/prime-ministers-remarks-addressing-canadians-covid-19-situation
Justin Trudeau,Canada,2020-09-16,"Good morning everyone.
Thanks for being here today.
We just wrapped up a Cabinet retreat here in Ottawa to map out our plan to keep Canadians safe and healthy, while building a more resilient Canada.
Canada and the world continue to face the ongoing threat of the global pandemic.
Over the last few months, we’ve learned that we can never let our guard down.
The fight against COVID-19 is far from over.
So we must stay focused on the task ahead.
We need to rebuild our economy while keeping Canadians safe.
These two goals are not mutually exclusive – they go together.
Healthier Canadians will mean, and has already meant, a healthier and stronger economy.
And on that front, today, we took yet another step forward.
Through the Safe Restart Agreement, reached earlier this summer, we announced federal funding to help provinces and territories safely restart the economy.
Provinces and territories were asked to outline in a letter just how these funds would be best allocated within their jurisdictions, based on their priorities.
The premiers have now submitted those letters which will allow over $19 billion in federal funding to flow toward our shared work to protect Canadians as we safely restart the economy.
The number of cases is rising across the country, and around the world.
Kids are also now going back to school and as a dad, I get how parents are worried.
Last month, we announced the Safe Return to Class Fund to help protect kids and staff with up to an extra $2 billion for the provinces and territories.  
Keeping our kids safe must always be our top priority.
This is why I’m asking Canadians to continue to be careful and to follow public health recommendations.
Limit the in-person contacts that you have. Take the appropriate precautions to reduce the risk of exposure so that you and your family stay safe, and download the government app to keep you and your friends and neighbours safe.
Every effort counts.
The Cabinet retreat has been very busy over the past few days.
It was an opportunity to get together to continue to develop our approach to this new world in which we live.
The Speech from the Throne will describe this approach in detail for Canadians next week.
We must continue to support Canadians in need during this crisis.
The pandemic has accentuated many of the inequalities that still exist in our society.
We must seize the opportunity of this economic recovery to build a healthier and safer Canada.
A Canada that’s fair and inclusive.
A Canada that’s clean and competitive.
On Monday, the COVID-19 Vaccine Task Force provided Cabinet with an update on their important work.
Dr. Tam also shared her thoughts on where we are in the fight against this virus and what we need to work on in the coming months.
We also heard from Sharleen Stewart, the President of the SEIU Healthcare union, who spoke about the challenges ahead this fall and winter, for long-term care, with a particular focus on how we must support those extraordinary workers who keep our elders safe and healthy.  
I am also pleased to confirm that we have accepted a request from the Quebec government to extend the mission of the Canadian Red Cross in Quebec long-term care facilities or CHSLDs. We responded from the start of the crisis, first with the Canadian Armed Forces and now with the Canadian Red Cross, and we are pleased to be able to continue to support our seniors.
Last weekend, a number of countries in Europe and around the world reported record daily increases of new cases.
We’re not immune to those trends.
Here in Canada, we’re seeing cases rise in many parts of the country too.
As everybody knows by now, each new case has the potential to multiply, and create even more cases.
So we are not out of the woods.
This is why I’m asking Canadians to continue to be very careful and follow public health recommendations.
Limit the in-person close contacts that you have.
Take appropriate precautions to reduce the risk of exposure, and keep yourself and your family safe.
And make sure you download the COVID Alert app.
These efforts help protect our grandparents, our parents, our front-line workers, and vulnerable people in our communities.
We have to show solidarity to keep each other safe.
We’ve come too far to give up now.
Together, Canadians must stay strong and vigilant. 
This afternoon, I also want to talk about jobs.
Lots of people are back at work, and that’s good news.
But I know that there are lots more people who are still struggling.
And there are many others who are worried that they could lose their job in these uncertain times.
If that’s you, know that your government will continue to be here to support you.
This pandemic has highlighted many of the inequalities that still exist in our society.
More than ever, we need an economy that benefits all Canadians.
During this retreat, and over the weeks and months to come, that’s exactly what our government will stay focused on.
To build a resilient Canada, our economy must be strong, and all Canadians must be able to benefit from it.
Our country must continue to be well-positioned on the world stage to attract investment and talent from around the world.
To discuss what to expect this fall, as well as Canada’s place in the global economic recovery and the fight against COVID-19, we spoke with Ambassador Rae, Ambassador Barton, and Ambassador Hillman.
Yesterday’s decision by the U.S. administration to remove unjustified tariffs on Canadian aluminum was the right thing to do.
This is very good news for both of our countries, as well as for Canadian aluminum workers.
When it comes to defending our workers and our economic interests, whether it is for aluminum or any other sector, we will always stand up for ourselves.
Aluminum trade between Canada and the United States has long been good for people on both sides of the border.
It supports jobs, and it grows our economies.  
I want to thank Minister Freeland, Minister Ng, and Ambassador Hillman for their hard work on this important issue.
Our government will always stand up for Canadian workers.
Yesterday, I also had a call with Chancellor Merkel of Germany.
We talked about the global response to COVID-19, from vaccine plans to our experiences with back to school.
We also discussed smart ways to grow our economies going forward in what has become a more unstable world.
And we both reiterated our condemnation of the poisoning of Russian opposition figure, Alexei Navalny. On the world stage, Canada will continue to work with our G7 allies and other international partners, to come up with bold solutions to the challenges we face.
And here at home, we will continue to work closely with provinces, territories, municipalities, Indigenous peoples, and businesses to drive the most important economic recovery of our generation.
Canadians deserve an ambitious plan for a healthier and safer Canada.
A Canada that’s fair and inclusive.
A Canada that’s clean and competitive.
And with the Speech from the Throne on September 23, that’s exactly what our government is ready to do.
Once again, I want to thank you all for joining us today.
",Prime Minister’s remarks following the Cabinet retreat,https://pm.gc.ca/en/news/speeches/2020/09/16/prime-ministers-remarks-following-cabinet-retreat
